{
  "$schema": "https://json-schema.org/draft/2020-12/schema",
  "$id": "xdebug.trace.driver.response.v1",
  "title": "trace.driver response",
  "type": "object",
  "required": [
    "api_version",
    "ok",
    "action",
    "summary",
    "data"
  ],
  "properties": {
    "api_version": {
      "type": "string",
      "enum": [
        "xdebug.v1"
      ]
    },
    "request_id": {
      "type": "string"
    },
    "ok": {
      "type": "boolean"
    },
    "action": {
      "type": "string",
      "enum": [
        "trace.driver"
      ]
    },
    "summary": {
      "type": "object",
      "required": [
        "signal",
        "mode",
        "path_count",
        "truncated"
      ],
      "properties": {
        "signal": {
          "type": "string"
        },
        "mode": {
          "type": "string",
          "enum": [
            "driver"
          ]
        },
        "path_count": {
          "type": "integer",
          "minimum": 0
        },
        "truncated": {
          "type": "boolean"
        }
      },
      "additionalProperties": false
    },
    "data": {
      "type": "object",
      "required": [
        "paths"
      ],
      "properties": {
        "summary": {
          "type": "object"
        },
        "paths": {
          "type": "array",
          "items": {
            "$ref": "#/$defs/source_path"
          }
        },
        "truncated": {
          "type": "boolean"
        },
        "common_blocks": {
          "type": "array"
        }
      },
      "additionalProperties": false
    },
    "error": {},
    "meta": {
      "type": "object"
    }
  },
  "$defs": {
    "source_path": {
      "type": "object",
      "required": [
        "file",
        "line",
        "source_context",
        "signal_path"
      ],
      "properties": {
        "file": {
          "type": "string"
        },
        "line": {
          "type": "integer",
          "minimum": 1
        },
        "source_context": {
          "type": "array",
          "items": {
            "type": "object",
            "required": [
              "line",
              "text",
              "active"
            ],
            "properties": {
              "line": {
                "type": "integer",
                "minimum": 1
              },
              "text": {
                "type": "string"
              },
              "active": {
                "type": "boolean"
              }
            },
            "additionalProperties": false
          }
        },
        "signal_path": {
          "type": "array",
          "items": {
            "type": "string"
          }
        }
      },
      "additionalProperties": false
    }
  },
  "additionalProperties": true,
  "description": "trace.driver response: 查找信号直接 driver。",
  "x-output_notes": "返回该 action 的 summary/data/error/meta；具体字段以 response schema 和 response example 为准。"
}
