{
  "api_version": "xdebug.v1",
  "ok": true,
  "action": "trace.driver",
  "summary": {
    "signal": "top.u.ready",
    "mode": "driver",
    "path_count": 1,
    "truncated": false
  },
  "data": {
    "paths": [
      {
        "file": "rtl/fifo.sv",
        "line": 42,
        "source_context": [
          {"line": 39, "text": "always_comb begin", "active": false},
          {"line": 40, "text": "  ready_n = 1'b0;", "active": false},
          {"line": 41, "text": "  if (!full) begin", "active": false},
          {"line": 42, "text": "    ready_n = valid_i;", "active": true},
          {"line": 43, "text": "  end", "active": false},
          {"line": 44, "text": "end", "active": false}
        ],
        "signal_path": [
          "top.u.valid_i",
          "top.u.ready"
        ]
      }
    ]
  }
}
